{
  "adapter_binding": {},
  "campaign_envelope_id": "ENV-9C1E913E0F79E8D29895",
  "created_at": "2026-08-07T12:11:33.111638Z",
  "execution_mode": "hybrid",
  "graph_generation_id": "GEN-1CB0DD09A15589DE8A53",
  "graph_revision": 1,
  "jobs": [
    {
      "job_id": "JOB-AD54CF75C345302FD817",
      "prompt_path": "JOB-AD54CF75C345302FD817",
      "title": "JOB-AD54CF75C345302FD817"
    },
    {
      "job_id": "JOB-E143D9FA5D5D977A1A8D",
      "prompt_path": "JOB-E143D9FA5D5D977A1A8D",
      "title": "JOB-E143D9FA5D5D977A1A8D"
    },
    {
      "job_id": "JOB-0E0D75B3EA0F16A692EC",
      "prompt_path": "JOB-0E0D75B3EA0F16A692EC",
      "title": "JOB-0E0D75B3EA0F16A692EC"
    },
    {
      "job_id": "JOB-F48417AA264A0992C3DD",
      "prompt_path": "JOB-F48417AA264A0992C3DD",
      "title": "JOB-F48417AA264A0992C3DD"
    },
    {
      "job_id": "JOB-01E880598A93E72B3E72",
      "prompt_path": "JOB-01E880598A93E72B3E72",
      "title": "JOB-01E880598A93E72B3E72"
    },
    {
      "job_id": "JOB-9791406767730B888412",
      "prompt_path": "JOB-9791406767730B888412",
      "title": "JOB-9791406767730B888412"
    },
    {
      "job_id": "JOB-AEF6BE0EB0EB9F104DD2",
      "prompt_path": "JOB-AEF6BE0EB0EB9F104DD2",
      "title": "JOB-AEF6BE0EB0EB9F104DD2"
    },
    {
      "job_id": "JOB-9BDFFA19C19FCF0A88CD",
      "prompt_path": "JOB-9BDFFA19C19FCF0A88CD",
      "title": "JOB-9BDFFA19C19FCF0A88CD"
    },
    {
      "job_id": "JOB-3E77B3BF5409AD1A9BE7",
      "prompt_path": "JOB-3E77B3BF5409AD1A9BE7",
      "title": "JOB-3E77B3BF5409AD1A9BE7"
    },
    {
      "job_id": "JOB-ADE97A4944C6AC2A07C7",
      "prompt_path": "JOB-ADE97A4944C6AC2A07C7",
      "title": "JOB-ADE97A4944C6AC2A07C7"
    },
    {
      "job_id": "JOB-D6D689E3D47C986C277E",
      "prompt_path": "JOB-D6D689E3D47C986C277E",
      "title": "JOB-D6D689E3D47C986C277E"
    },
    {
      "job_id": "JOB-DC65510F2659AD9F9BB3",
      "prompt_path": "JOB-DC65510F2659AD9F9BB3",
      "title": "JOB-DC65510F2659AD9F9BB3"
    },
    {
      "job_id": "JOB-89317D3F846644ABC5AC",
      "prompt_path": "JOB-89317D3F846644ABC5AC",
      "title": "JOB-89317D3F846644ABC5AC"
    },
    {
      "job_id": "JOB-CCA88DD2B6EF5AFFEE22",
      "prompt_path": "JOB-CCA88DD2B6EF5AFFEE22",
      "title": "JOB-CCA88DD2B6EF5AFFEE22"
    },
    {
      "job_id": "JOB-156087F087CE46DFC2DC",
      "prompt_path": "JOB-156087F087CE46DFC2DC",
      "title": "JOB-156087F087CE46DFC2DC"
    },
    {
      "job_id": "JOB-A9E8CF7DB115CAE6DD51",
      "prompt_path": "JOB-A9E8CF7DB115CAE6DD51",
      "title": "JOB-A9E8CF7DB115CAE6DD51"
    },
    {
      "job_id": "JOB-E65E5D2689A74C0BB733",
      "prompt_path": "JOB-E65E5D2689A74C0BB733",
      "title": "JOB-E65E5D2689A74C0BB733"
    }
  ],
  "request_path": "C:\\Projects\\BlackholeSim\\.job-orchestrator\\tmp\\request-tde-hang.md",
  "run_id": "2026-08-07T121133Z-investigate-why-tde-mode-hangs-chrome-browser-and",
  "schema_version": 6,
  "workspace": "C:\\Projects\\BlackholeSim"
}
